library	gt_name	gsai_name	gsai_ROUGE1	gsai_ROUGE2	gsai_ROUGEL	gsai_csim
Reactome_2022	Activated Point Mutants Of FGFR2	Fibroblast Growth Regulation and Development	0.0	0.0	0.0	0.44716979263554235
Reactome_2022	Activation Of AMPK Downstream Of NMDARs	AMP-activated protein kinase (AMPK) signaling pathway in metabolic regulation	0.3333333333333333	0.0	0.25	0.5641969986208548
Reactome_2022	Activation Of APC/C And APC/C:Cdc20 Mediated Degradation Of Mitotic Proteins	Protein degradation via the ubiquitin-proteasome system	0.15384615384615385	0.0	0.1	0.47708955073396964
Reactome_2022	Activation Of ATR In Response To Replication Stress	DNA Replication and Cell Cycle Regulation	0.125	0.0	0.14285714285714288	0.47613133793540385
Reactome_2022	Activation Of BAD And Translocation To Mitochondria	Apoptosis regulation via Akt signaling and apoptosis antagonist proteins	0.14285714285714285	0.0	0.125	0.46386004552760085
Reactome_2022	Activation Of BH3-only Proteins	Apoptosis and Cell Survival Regulation	0.0	0.0	0.0	0.4427679448914415
Reactome_2022	Activation Of C3 And C5	Complement activation and regulation	0.4	0.0	0.4444444444444445	0.6247432122078773
Reactome_2022	Activation Of Ca-permeable Kainate Receptor	Postsynaptic structural and functional modulation in glutamatergic synapses	0.0	0.0	0.0	0.44507291311923713
Reactome_2022	Activation Of G Protein Gated Potassium Channels	Potassium Channel Regulation and G-Protein Signaling	0.5714285714285714	0.3333333333333333	0.2857142857142857	0.7248757389383423
Reactome_2022	Activation Of GABAB Receptors	G-Protein Coupled Potassium Channel Regulation and Signal Transduction	0.0	0.0	0.0	0.4452557218038441
Reactome_2022	Activation Of HOX Genes During Differentiation	Transcription Regulation and Chromatin Remodeling	0.0	0.0	0.0	0.3534237548896667
Reactome_2022	Activation Of IRF3/IRF7 Mediated By TBK1/IKK Epsilon	Innate immune signaling and ubiquitin-proteasome system	0.0	0.0	0.0	0.459515618293477
Reactome_2022	Activation Of Matrix Metalloproteinases	Extracellular matrix remodeling and proteolysis	0.25	0.0	0.22222222222222224	0.6422165119543444
Reactome_2022	Activation Of NF-kappaB In B Cells	Proteasome and NF-kB signaling regulation	0.14285714285714285	0.0	0.15384615384615383	0.5953623406507541
Reactome_2022	Activation Of NIMA Kinases NEK9, NEK6, NEK7	Mitotic progression and spindle assembly	0.0	0.0	0.0	0.44123115990081785
Reactome_2022	Activation Of NMDA Receptors And Postsynaptic Events	Synaptic Plasticity and Neural Signaling	0.14285714285714285	0.0	0.16666666666666666	0.5063067296286659
Reactome_2022	Activation Of NOXA And Translocation To Mitochondria	** Cell Cycle Regulation and Apoptosis  	0.14285714285714285	0.0	0.16666666666666666	0.40027400177801703
Reactome_2022	Activation Of PPARGC1A (PGC-1alpha) By Phosphorylation	AMPK and MAPK pathways in cellular stress response and energy homeostasis	0.0	0.0	0.0	0.5027449991510756
Reactome_2022	Activation Of PUMA And Translocation To Mitochondria	Apoptosis and Cell Cycle Regulation	0.14285714285714285	0.0	0.16666666666666666	0.41464118859278026
Reactome_2022	Activation Of RAC1	Cytoskeletal Reorganization and Cellular Adhesion	0.0	0.0	0.0	0.3939864824258355
Reactome_2022	Activation Of RAC1 Downstream Of NMDARs	Calcium/Calmodulin-Dependent Signaling and Cytoskeletal Regulation	0.0	0.0	0.0	0.4443367930263594
Reactome_2022	Activation Of SMO	Hedgehog Signaling Pathway Regulation	0.0	0.0	0.0	0.41736883418398735
Reactome_2022	Activation Of TRKA Receptors	Neuronal Development and Function Modulation	0.0	0.0	0.0	0.40426315525582335
Reactome_2022	Activation Of Caspases Thru Apoptosome-Mediated Cleavage	Intrinsic Apoptosis Pathway Regulation	0.0	0.0	0.0	0.5473630417585256
Reactome_2022	Activation Of Gene Expression By SREBF (SREBP)	Cholesterol and fatty acid biosynthesis regulation	0.0	0.0	0.0	0.5258833093175814
Reactome_2022	Activation Of Kainate Receptors Upon Glutamate Binding	G-protein signaling and phosphoinositide pathway regulation	0.0	0.0	0.0	0.30959830307141584
Reactome_2022	Activation Of AP-1 Family Of Transcription Factors	Growth Factor Signaling and MAPK Pathway Regulation	0.125	0.0	0.13333333333333333	0.4657230102227858
Reactome_2022	Activation Of TFAP2 (AP-2) Family Of Transcription Factors	Transcriptional Regulation in Cell Differentiation and Gene Expression	0.1111111111111111	0.0	0.11764705882352941	0.4603885774153884
Reactome_2022	mRNA Activation Upon Binding Of Cap-Binding Complex And eIFs, Subsequent Binding To 43S	Ribosome Assembly and Translation Initiation	0.07142857142857142	0.0	0.10526315789473682	0.5479511598705689
Reactome_2022	Activation Of Phototransduction Cascade	Phototransduction in visual perception	0.25	0.0	0.25	0.6902525648642751
Reactome_2022	Activation Of Pre-Replicative Complex	DNA Replication and Initiation	0.2	0.0	0.22222222222222224	0.5560429393944998
Reactome_2022	Acyl Chain Remodeling Of CL	Mitochondrial Fatty Acid Beta-Oxidation and Remodeling of Cardiolipin	0.4	0.25	0.2857142857142857	0.6019359142469285
Reactome_2022	Acyl Chain Remodeling Of DAG And TAG	Triacylglycerol Metabolism and Lipid Homeostasis	0.14285714285714285	0.0	0.16666666666666666	0.5663194567427405
Reactome_2022	Acyl Chain Remodelling Of PC	Phospholipid Metabolism and Remodeling	0.2	0.0	0.22222222222222224	0.6424032510916478
Reactome_2022	Acyl Chain Remodelling Of PE	Phospholipid Metabolism and Remodeling	0.2	0.0	0.22222222222222224	0.6099799101133652
Reactome_2022	Acyl Chain Remodelling Of PG	Phospholipid Metabolism and Homeostasis	0.0	0.0	0.0	0.43154924551291607
Reactome_2022	Acyl Chain Remodelling Of PI	Phospholipase A2 activity and lipid metabolism regulation	0.0	0.0	0.0	0.4869957893246991
Reactome_2022	Acyl Chain Remodelling Of PS	Phospholipase-mediated lipid metabolism and signaling	0.0	0.0	0.0	0.4639114248586282
Reactome_2022	Adaptive Immune System	Protein Degradation and Ubiquitin-Proteasome System Regulation	0.3333333333333333	0.0	0.2	0.2962095532345096
Reactome_2022	Adenylate Cyclase Activating Pathway	Signal Transduction via Adenylyl Cyclase Complex	0.25	0.0	0.2	0.7376425752010436
Reactome_2022	Adenylate Cyclase Inhibitory Pathway	cAMP Signaling Pathway Regulation	0.25	0.0	0.25	0.4621509931063795
Reactome_2022	Adherens Junctions Interactions	Cell-Cell Adhesion and Signal Transduction in Neuronal and Epithelial Tissues  	0.0	0.0	0.0	0.5261923542624682
Reactome_2022	Adrenaline,noradrenaline Inhibits Insulin Secretion	G-protein coupled signal transduction and calcium channel regulation  	0.0	0.0	0.0	0.22495680941177304
Reactome_2022	Adrenoceptors	Adrenergic signaling and regulation	0.0	0.0	0.0	0.5712696845865803
Reactome_2022	Advanced Glycosylation Endproduct Receptor Signaling	Inflammatory Response Mediated by Advanced Glycation End Products (AGEs)	0.2	0.0	0.14285714285714285	0.6454142992663763
Reactome_2022	Aflatoxin Activation And Detoxification	Gamma-glutamyl cycle and xenobiotic metabolism	0.25	0.0	0.2	0.47810207562582996
Reactome_2022	Aggrephagy	Protein Degradation and Cellular Transport Regulation	0.0	0.0	0.0	0.3499301617455861
Reactome_2022	Alpha-defensins	Innate Immunity and Digestive Enzymatic Activity	0.0	0.0	0.0	0.4177155023201989
Reactome_2022	Alpha-oxidation Of Phytanate	Peroxisomal Fatty Acid β-oxidation and Metabolism	0.25	0.0	0.2	0.5548543536457552
Reactome_2022	Alpha-protein Kinase 1 Signaling Pathway	Ubiquitin-mediated signaling and inflammatory response	0.16666666666666666	0.0	0.16666666666666666	0.4187834108021894
Reactome_2022	Amine Ligand-Binding Receptors	Neurotransmitter signaling and receptor modulation	0.25	0.0	0.22222222222222224	0.5421111722378338
Reactome_2022	Amino Acid Conjugation	Mitochondrial fatty acid beta-oxidation and conjugation processes	0.6666666666666666	0.0	0.36363636363636365	0.5387955121089598
Reactome_2022	Amino Acid Transport Across Plasma Membrane	Amino Acid Transport and Homeostasis	0.5	0.4	0.5454545454545454	0.7602480991300853
Reactome_2022	Amino Acids Regulate mTORC1	mTOR signaling and lysosomal function regulation	0.25	0.0	0.2	0.6100347425572517
Reactome_2022	Unattached Kinetochores Signal Amplification Via A MAD2 Inhibitory Signal	Mitotic Spindle Assembly and Chromosome Segregation	0.0	0.0	0.0	0.46901598008992385
Reactome_2022	Amyloid Fiber Formation	Chromatin Structure and Remodeling	0.0	0.0	0.0	0.2935418157711029
Reactome_2022	Anchoring Fibril Formation	Extracellular Matrix Organization and Remodeling	0.0	0.0	0.0	0.49765609480429207
Reactome_2022	Anchoring Of Basal Body To Plasma Membrane	Ciliogenesis and Centrosome Function	0.0	0.0	0.0	0.4356076547554716
Reactome_2022	Androgen Biosynthesis	Steroid Hormone Biosynthesis and Regulation	0.5	0.0	0.28571428571428575	0.6866795997644721
Reactome_2022	Anti-inflammatory Response Favoring Leishmania Infection	Neuroendocrine signaling and regulation	0.0	0.0	0.0	0.19321755739114893
Reactome_2022	Antigen Presentation: Folding, Assembly, Peptide Loading Of Class I MHC	Antigen processing and presentation	0.2	0.0	0.28571428571428575	0.6806953562203976
Reactome_2022	Antigen Activates B Cell Receptor Leading To Second Messenger Generation	B-cell receptor signaling and calcium mobilization	0.3	0.2222222222222222	0.3529411764705882	0.6780327024286453
Reactome_2022	Antigen processing-Cross Presentation	Antigen processing and presentation through major histocompatibility complex (MHC) class I and II pathways	0.75	0.3333333333333333	0.3333333333333333	0.6364574223041559
Reactome_2022	Antigen Processing: Ubiquitination And Proteasome Degradation	Protein Degradation and Ubiquitin-Proteasome System	0.6666666666666666	0.0	0.3333333333333333	0.6407483490039981
Reactome_2022	Antimicrobial Peptides	Antimicrobial Defense and Innate Immunity	0.5	0.0	0.28571428571428575	0.5986925677821922
Reactome_2022	Antiviral Mechanism By IFN-stimulated Genes	Nucleocytoplasmic Transport and Antiviral Response	0.16666666666666666	0.0	0.1818181818181818	0.5111667302792
Reactome_2022	Apoptosis	Apoptosis and Proteasome-Mediated Protein Degradation	1.0	0.0	0.2857142857142857	0.6318632529608312
Reactome_2022	Apoptosis Induced DNA Fragmentation	Apoptosis and chromatin remodeling	0.25	0.0	0.25	0.6455237142386984
Reactome_2022	Apoptotic Cleavage Of Cell Adhesion Proteins	Tight Junction and Adherens Junction Assembly and Regulation	0.0	0.0	0.0	0.4346910675098423
Reactome_2022	Apoptotic Cleavage Of Cellular Proteins	Cell-Cell Junction Assembly and Regulation	0.0	0.0	0.0	0.3230520932102685
Reactome_2022	Apoptotic Execution Phase	Apoptosis and Cytoskeletal Remodeling	0.0	0.0	0.0	0.5552877211800404
Reactome_2022	Apoptotic Factor-Mediated Response	Apoptosis Regulation and Execution	0.0	0.0	0.0	0.593397682507903
Reactome_2022	Aquaporin-mediated Transport	Signal Transduction and Water Homeostasis	0.0	0.0	0.0	0.5001363658062229
Reactome_2022	Arachidonate Production From DAG	Endocannabinoid metabolism and signaling	0.0	0.0	0.0	0.37106997324012514
Reactome_2022	Arachidonic Acid Metabolism	Eicosanoid and fatty acid metabolism	0.6666666666666666	0.5	0.5	0.696294974023419
Reactome_2022	Aryl Hydrocarbon Receptor Signaling	Molecular Chaperoning and Stress Response Regulation	0.0	0.0	0.0	0.2934670888534001
Reactome_2022	Asparagine N-linked Glycosylation	Protein Glycosylation and Trafficking	0.25	0.0	0.25	0.5781953175624283
Reactome_2022	Aspartate And Asparagine Metabolism	Amino Acid and Nitrogen Metabolism	0.5	0.0	0.4444444444444445	0.6291679528779641
Reactome_2022	Aspirin ADME	Xenobiotic metabolism and detoxification**  	0.0	0.0	0.0	0.2762544316572812
Reactome_2022	Assembly Of HIV Virion	Endosomal sorting and ubiquitin-proteasome system regulation	0.0	0.0	0.0	0.26807204005991625
Reactome_2022	Assembly And Cell Surface Presentation Of NMDA Receptors	Synaptic organization and neural signaling	0.125	0.0	0.15384615384615385	0.3955376505233121
Reactome_2022	Assembly Of Active LPL And LIPC Lipase Complexes	Lipid metabolism and regulation	0.125	0.0	0.16666666666666666	0.5088239915085717
Reactome_2022	Assembly Of Collagen Fibrils And Other Multimeric Structures	Extracellular Matrix Remodeling and Stability	0.125	0.0	0.15384615384615385	0.5388841628621968
Reactome_2022	Assembly Of ORC Complex At Origin Of Replication	Histone Modification and DNA Replication Regulation  	0.125	0.0	0.14285714285714288	0.402833740674929
Reactome_2022	Assembly Of Pre-Replicative Complex	Proteostasis and Chromatin Dynamics Regulation  	0.0	0.0	0.0	0.332088085608117
Reactome_2022	Association Of TriC/CCT With Target Proteins During Biosynthesis	Protein Folding and Ubiquitin-Mediated Degradation	0.1111111111111111	0.0	0.13333333333333333	0.40719026517477686
Reactome_2022	Asymmetric Localization Of PCP Proteins	Proteasome-mediated protein degradation and regulation	0.2	0.0	0.1818181818181818	0.3203911907091033
Reactome_2022	Atorvastatin ADME	Xenobiotic and Drug Metabolism	0.0	0.0	0.0	0.3443963595000248
Reactome_2022	Attachment And Entry	Viral Entry and Host Cell Regulation	0.6666666666666666	0.0	0.2222222222222222	0.5814347181373412
Reactome_2022	Attachment Of GPI Anchor To uPAR	GPI-anchor biosynthesis and modification	0.3333333333333333	0.2	0.3636363636363636	0.6471983848081654
Reactome_2022	Attenuation Phase	Heat shock response and protein folding regulation	0.0	0.0	0.0	0.15020909667659205
Reactome_2022	Autodegradation Of Cdh1 By Cdh1:APC/C	Proteasome-mediated protein degradation	0.0	0.0	0.0	0.49945102909253625
Reactome_2022	Autodegradation Of E3 Ubiquitin Ligase COP1	Proteasome-mediated protein degradation	0.0	0.0	0.0	0.5540314300002707
Reactome_2022	Autophagy	Autophagy and lysosomal-mediated degradation	1.0	0.0	0.33333333333333337	0.6588665150902332
Reactome_2022	Axon Guidance	Ribosomal assembly and proteasome-mediated protein degradation	0.0	0.0	0.0	0.17113265048859105
Reactome_2022	Axonal Growth Inhibition (RHOA Activation)	Neural Growth and Regeneration Signaling	0.2	0.0	0.20000000000000004	0.5248635633343901
Reactome_2022	Azathioprine ADME	Purine Metabolism and Cellular Response to Therapy	0.0	0.0	0.0	0.4456450506221475
Reactome_2022	B-WICH Complex Positively Regulates rRNA Expression	Chromatin Remodeling and Transcription Regulation	0.14285714285714285	0.0	0.16666666666666666	0.44265125308478515
Reactome_2022	BBSome-mediated Cargo-Targeting To Cilium	Bardet-Biedl Syndrome Complex and Ciliogenesis	0.0	0.0	0.0	0.5381642080514659
Reactome_2022	BH3-only Proteins Associate With And Inactivate Anti-Apoptotic BCL-2 Members	Apoptosis Regulation and Mitochondrial Pathways	0.08333333333333333	0.0	0.11764705882352941	0.4812531996350916
Reactome_2022	BMAL1:CLOCK,NPAS2 Activates Circadian Gene Expression	Circadian Rhythm Regulation and Transcriptional Coactivation	0.14285714285714285	0.0	0.15384615384615383	0.599240372346862
Reactome_2022	Base Excision Repair	DNA Replication, Repair, and Chromatin Structure Modulation	0.3333333333333333	0.0	0.2	0.4044680024502947
Reactome_2022	Base-Excision Repair, AP Site Formation	DNA damage recognition and repair	0.16666666666666666	0.0	0.1818181818181818	0.5407360656817486
Reactome_2022	Basigin Interactions	Cellular Transport and Extra-Cellular Matrix Remodeling	0.0	0.0	0.0	0.3559663236188628
Reactome_2022	Beta Defensins	Antimicrobial immune response and chemotactic signaling	0.0	0.0	0.0	0.4073587701293657
Reactome_2022	Beta Oxidation Of butanoyl-CoA To acetyl-CoA	Medium-chain fatty acid metabolism	0.0	0.0	0.0	0.500392148383537
Reactome_2022	Beta Oxidation Of decanoyl-CoA To octanoyl-CoA-CoA	Mitochondrial Fatty Acid Beta-Oxidation	0.2222222222222222	0.125	0.2857142857142857	0.616910685328846
Reactome_2022	Beta Oxidation Of hexanoyl-CoA To butanoyl-CoA	Fatty Acid Beta-Oxidation	0.25	0.14285714285714285	0.3333333333333333	0.5972539926372552
Reactome_2022	Beta Oxidation Of lauroyl-CoA To decanoyl-CoA-CoA	Fatty acid β-oxidation	0.1111111111111111	0.0	0.16666666666666666	0.6018264298386788
Reactome_2022	Beta Oxidation Of octanoyl-CoA To hexanoyl-CoA	Fatty Acid Beta-Oxidation and Energy Production	0.25	0.14285714285714285	0.26666666666666666	0.5748348852767338
Reactome_2022	Beta-catenin Independent WNT Signaling	Proteasome-mediated regulation of Wnt signaling and G-protein signaling	0.4	0.25	0.26666666666666666	0.571693412468538
Reactome_2022	Beta-catenin Phosphorylation Cascade	Wnt/β-Catenin Signaling Pathway Modulation	0.25	0.0	0.22222222222222224	0.6097010949753728
Reactome_2022	Beta-oxidation Of pristanoyl-CoA	Peroxisomal β-oxidation of branched-chain fatty acids	0.4	0.25	0.3333333333333333	0.6398437470823769
Reactome_2022	Beta-oxidation Of Very Long Chain Fatty Acids	Peroxisomal fatty acid β-oxidation	0.375	0.14285714285714285	0.3333333333333333	0.6219916203550057
Reactome_2022	Bicarbonate Transporters	Bicarbonate Transport and pH Regulation	1.0	1.0	0.5714285714285715	0.7257123524113389
Reactome_2022	Bile Acid And Bile Salt Metabolism	Cholesterol and Bile Acid Metabolism	0.6666666666666666	0.4	0.5454545454545454	0.8270408995962042
Reactome_2022	Binding And Uptake Of Ligands By Scavenger Receptors	Immune system modulation and extracellular matrix remodeling	0.125	0.0	0.13333333333333333	0.3157148639654084
Reactome_2022	Binding And Entry Of HIV Virion	Immune Response Modulation in HIV Infection	0.16666666666666666	0.0	0.16666666666666666	0.4450093853581025
Reactome_2022	Binding Of TCF/LEF:CTNNB1 To Target Gene Promoters	Wnt/β-catenin signaling pathway in cellular proliferation and differentiation	0.0	0.0	0.0	0.48477920264627183
Reactome_2022	Biological Oxidations	Xenobiotic Metabolism and Detoxification	0.0	0.0	0.0	0.41562959618835893
Reactome_2022	Biosynthesis Of DHA-derived SPMs	Arachidonic acid metabolism and eicosanoid synthesis	0.0	0.0	0.0	0.5409497935759632
Reactome_2022	Biosynthesis Of E-series 18(S)-resolvins	Eicosanoid Metabolism and Inflammatory Response Regulation	0.0	0.0	0.0	0.5610552110331024
Reactome_2022	Biosynthesis Of EPA-derived SPMs	Eicosanoid metabolism and oxidative stress regulation	0.0	0.0	0.0	0.5254318792702652
Reactome_2022	Biosynthesis Of Maresin-Like SPMs	Xenobiotic Metabolism and Detoxification	0.0	0.0	0.0	0.2872689764872741
Reactome_2022	Biosynthesis Of Maresins	Xenobiotic Metabolism and Detoxification	0.0	0.0	0.0	0.29697068219979733
Reactome_2022	Biosynthesis Of Specialized Proresolving Mediators (SPMs)	Arachidonic Acid Metabolism and Eicosanoid Synthesis	0.0	0.0	0.0	0.5279041144300959
Reactome_2022	Biosynthesis Of N-glycan Precursor (Dolichol LLO) And Transfer To Protein	Protein Glycosylation and Glycan Synthesis 	0.2727272727272727	0.0	0.12500000000000003	0.6388608100696094
Reactome_2022	Biotin Transport And Metabolism	Biotin Metabolism and Carboxylase Regulation	0.75	0.0	0.4444444444444445	0.7593506048796475
Reactome_2022	Blood Group Systems Biosynthesis	Glycosylation and Blood Group Antigen Biosynthesis	0.75	0.3333333333333333	0.6	0.6599144863921184
Reactome_2022	Branched-chain Amino Acid Catabolism	Branched-Chain Amino Acid (BCAA) Metabolism	0.8	0.75	0.7272727272727272	0.7992731145724898
Reactome_2022	Budding And Maturation Of HIV Virion	Endosomal Sorting and Multivesicular Body (MVB) Biogenesis	0.16666666666666666	0.0	0.15384615384615383	0.3928848339091192
Reactome_2022	Butyrate Response Factor 1 Binds And Destabilizes mRNA	RNA degradation and processing	0.125	0.0	0.16666666666666666	0.37792429305535213
Reactome_2022	Butyrophilin (BTN) Family Interactions	Immunomodulation and Signaling Regulation	0.0	0.0	0.0	0.33532718634884395
Reactome_2022	C-type Lectin Receptors (CLRs)	Immune Response Regulation and Protein Degradation	0.0	0.0	0.0	0.3169687372009878
Reactome_2022	CASP8 Activity Is Inhibited	Apoptosis Regulation and Fas/TNF Signaling Pathways	0.0	0.0	0.0	0.4624787991488845
Reactome_2022	CD163 Mediating An Anti-Inflammatory Response	Inflammatory Response and Cytokine Signaling	0.3333333333333333	0.2	0.3636363636363636	0.5845572717245603
Reactome_2022	CD209 (DC-SIGN) Signaling	Immune Cell Activation and Signal Transduction	0.25	0.0	0.2	0.5689532987762491
Reactome_2022	CD22 Mediated BCR Regulation	B-Cell Receptor Signaling Pathway	0.0	0.0	0.0	0.6273970901258756
Reactome_2022	CD28 Co-Stimulation	T Cell Activation and Signal Transduction	0.0	0.0	0.0	0.5142314662945723
Reactome_2022	CD28 Dependent PI3K/Akt Signaling	T-cell activation and signaling regulation  	0.2	0.0	0.1818181818181818	0.5551677139005369
Reactome_2022	CD28 Dependent Vav1 Pathway	T-cell co-stimulation and activation  	0.0	0.0	0.0	0.4898112348069823
Reactome_2022	CDC42 GTPase Cycle	Rho GTPase-mediated regulation of cytoskeleton organization and signaling	0.3333333333333333	0.0	0.16666666666666666	0.5510456172883273
Reactome_2022	CDC6 Association With ORC:origin Complex	DNA Replication Initiation	0.0	0.0	0.0	0.4518265375999292
Reactome_2022	CDK-mediated Phosphorylation And Removal Of Cdc6	Protein ubiquitination and proteasome-mediated degradation	0.2857142857142857	0.0	0.15384615384615383	0.4113034768231296
Reactome_2022	CHL1 Interactions	Cell Adhesion and Signal Transduction	0.0	0.0	0.0	0.32311602885448537
Reactome_2022	CLEC7A (Dectin-1) Induces NFAT Activation	Calcium Signaling Pathway in Immune Response and Transcriptional Regulation	0.0	0.0	0.0	0.4841987786924632
Reactome_2022	CLEC7A (Dectin-1) Signaling	Proteasome and NF-kB Signaling Pathway	0.25	0.0	0.2	0.46389632286435356
Reactome_2022	CLEC7A/inflammasome Pathway	Inflammatory Signaling Pathway and Apoptosis Regulation	0.3333333333333333	0.0	0.2222222222222222	0.5345687127006816
Reactome_2022	COPI-dependent Golgi-to-ER Retrograde Traffic	Intracellular Transport and Microtubule-Based Motility	0.0	0.0	0.0	0.4521595900958629
Reactome_2022	COPI-independent Golgi-to-ER Retrograde Traffic	Cytoplasmic microtubule-based vesicular transport	0.0	0.0	0.0	0.5296213626672532
Reactome_2022	COPI-mediated Anterograde Transport	Intracellular Transport and Vesicle-Mediated Trafficking	0.5	0.0	0.2	0.5627567653334103
Reactome_2022	COPII-mediated Vesicle Transport	ER-to-Golgi vesicle-mediated transport	0.75	0.0	0.4	0.7053704821170809
Reactome_2022	CREB Phosphorylation	Neurotrophic Signaling and Synaptic Plasticity	0.0	0.0	0.0	0.37216468416603166
Reactome_2022	CREB1 Phosphorylation Thru NMDA Receptor-Mediated Activation Of RAS Signaling	Synaptic signaling and plasticity	0.1	0.0	0.14285714285714288	0.37215054357624555
Reactome_2022	CREB1 Phosphorylation Thru Activation Of Adenylate Cyclase	cAMP-dependent signaling and regulation	0.0	0.0	0.0	0.5015352397964133
Reactome_2022	CREB1 Phosphorylation Thru Activation Of CaMKII/CaMKK/CaMKIV Cascasde	Calcium-mediated Signal Transduction and Gene Regulation	0.0	0.0	0.0	0.46050096066001145
Reactome_2022	CREB3 Factors Activate Genes	ER stress response and lipid metabolism regulation	0.0	0.0	0.0	0.3761502126915795
Reactome_2022	CRMPs In Sema3A Signaling	Axon guidance and neural development	0.0	0.0	0.0	0.37426704648630416
Reactome_2022	CS/DS Degradation	Glycosaminoglycan Metabolism and Catabolism	0.0	0.0	0.0	0.3082226433317296
Reactome_2022	CTLA4 Inhibitory Signaling	T cell activation and immune signaling regulation	0.3333333333333333	0.0	0.2	0.5273443641340262
Reactome_2022	CTNNB1 S33 Mutants Not Phosphorylated	Wnt Signaling Pathway Regulation	0.0	0.0	0.0	0.44497910754471626
Reactome_2022	CYP2E1 Reactions	Cytochrome P450-mediated Drug Metabolism	0.0	0.0	0.0	0.4721833907666241
Reactome_2022	Ca-dependent Events	cAMP-mediated signal transduction and regulation	0.0	0.0	0.0	0.4516044998360962
Reactome_2022	Ca2+ Activated K+ Channels	Calcium-activated potassium channel regulation	0.5	0.0	0.4444444444444445	0.7742166428447994
Reactome_2022	Ca2+ Pathway	Wnt Signaling and G-Protein Coupled Pathways	0.5	0.0	0.22222222222222224	0.4335378870864838
Reactome_2022	CaM Pathway	cAMP-dependent signaling and modulation	0.0	0.0	0.0	0.47242133832033106
Reactome_2022	CaMK IV-mediated Phosphorylation Of CREB	Calcium/Calmodulin-Dependent Protein Kinase (CaMK) Signaling	0.16666666666666666	0.0	0.15384615384615383	0.6258475915736383
Reactome_2022	Calcineurin Activates NFAT	Calcineurin-NFAT signaling pathway	0.6666666666666666	0.0	0.5714285714285715	0.7776424052820635
Reactome_2022	Calcitonin-like Ligand Receptors	Peptide Hormone Signaling and Regulation	0.0	0.0	0.0	0.3707249935296231
Reactome_2022	Calnexin/calreticulin Cycle	Protein Quality Control and ER-associated Degradation (ERAD)	0.0	0.0	0.0	0.440185680227737
Reactome_2022	Cap-dependent Translation Initiation	Ribosome Biogenesis and Translation Initiation	0.5	0.3333333333333333	0.4444444444444445	0.6372683574801065
Reactome_2022	Carboxyterminal Post-Translational Modifications Of Tubulin	Tubulin modification and microtubule dynamics	0.3333333333333333	0.0	0.1818181818181818	0.6643072082165036
Reactome_2022	Cardiac Conduction	Cardiac Electrophysiological Regulation	0.5	0.0	0.4	0.5953179321159547
Reactome_2022	Cargo Concentration In ER	Protein secretion and trafficking	0.0	0.0	0.0	0.248571458621432
Reactome_2022	Cargo Recognition For Clathrin-Mediated Endocytosis	Endocytosis and Signal Transduction Regulation	0.16666666666666666	0.0	0.1818181818181818	0.5266978890790863
Reactome_2022	Cargo Trafficking To Periciliary Membrane	Ciliogenesis and Ciliary Function	0.0	0.0	0.0	0.3889863078187051
Reactome_2022	Carnitine Metabolism	Lipid Metabolism and Energy Homeostasis	0.5	0.0	0.28571428571428575	0.5289997678111799
Reactome_2022	Caspase Activation Via Death Receptors In Presence Of Ligand	Apoptotic Signaling Pathway via Death Receptors	0.3333333333333333	0.25	0.4	0.7242753967636977
Reactome_2022	Caspase Activation Via Dependence Receptors In Absence Of Ligand	Apoptotic Signaling Pathway Involving Death Receptors	0.1111111111111111	0.0	0.13333333333333333	0.589246361753127
Reactome_2022	Caspase Activation Via Extrinsic Apoptotic Signaling Pathway	Apoptosis and TNF-related signaling pathways	0.2857142857142857	0.16666666666666666	0.30769230769230765	0.5926253179749852
Reactome_2022	Caspase-mediated Cleavage Of Cytoskeletal Proteins	Cytoskeletal Dynamics and Apoptosis Regulation	0.16666666666666666	0.0	0.1818181818181818	0.6238964258915354
