library	gt_name	gsai_name	gsai_ROUGE1	gsai_ROUGE2	gsai_ROUGEL	gsai_csim
Reactome_2022	Nef-mediated Downmodulation Of Cell Surface Receptors By Recruitment To Clathrin Adapters	Vesicle-mediated transport and immune cell signaling	0.16666666666666666	0.0	0.2105263157894737	0.4697440196657497
Reactome_2022	Negative Epigenetic Regulation Of rRNA Expression	Chromatin remodeling and transcription regulation	0.16666666666666666	0.0	0.1818181818181818	0.48392925940552395
Reactome_2022	Negative Feedback Regulation Of MAPK Pathway	MAPK/ERK Signaling Pathway	0.3333333333333333	0.0	0.4	0.5838973948063996
Reactome_2022	Negative Regulation Of FGFR1 Signaling	Fibroblast Growth Factor Signaling Pathway	0.2	0.0	0.20000000000000004	0.5887579527257789
Reactome_2022	Negative Regulation Of FGFR2 Signaling	Fibroblast Growth Factor Signaling Pathway	0.2	0.0	0.20000000000000004	0.5722572056067114
Reactome_2022	Negative Regulation Of FGFR3 Signaling	Fibroblast Growth Factor Signaling Pathway	0.2	0.0	0.20000000000000004	0.5373517460272579
Reactome_2022	Negative Regulation Of FGFR4 Signaling	Fibroblast Growth Factor Receptor Signaling and Regulation	0.4	0.0	0.16666666666666666	0.6627303815491179
Reactome_2022	Negative Regulation Of FLT3	Regulation of hematopoietic stem cell differentiation and growth signaling	0.5	0.3333333333333333	0.30769230769230765	0.53679129676106
Reactome_2022	Negative Regulation Of MAPK Pathway	MAPK signaling and regulation	0.4	0.0	0.22222222222222224	0.6811376928765482
Reactome_2022	Negative Regulation Of MET Activity	Ubiquitin-Proteasome System and Signal Transduction Regulation	0.2	0.0	0.16666666666666666	0.4172605849538643
Reactome_2022	Negative Regulation Of NMDA Receptor-Mediated Neuronal Transmission	Synaptic signaling and plasticity	0.0	0.0	0.0	0.4029488130468759
Reactome_2022	Negative Regulation Of NOTCH4 Signaling	Proteasome-mediated protein degradation	0.0	0.0	0.0	0.2735258187771144
Reactome_2022	Negative Regulation Of TCF-dependent Signaling By WNT Ligand Antagonists	Wnt Signaling Modulation	0.2	0.0	0.15384615384615383	0.6514968897364377
Reactome_2022	Negative Regulation Of Activity Of TFAP2 (AP-2) Family Transcription Factors	Transcriptional Regulation of Gene Expression	0.2727272727272727	0.1	0.25000000000000006	0.47999269283589346
Reactome_2022	Negative Regulation Of PI3K/AKT Network	Growth factor signaling and regulation	0.16666666666666666	0.0	0.1818181818181818	0.453182114536412
Reactome_2022	Negative Regulators Of DDX58/IFIH1 Signaling	** Immune Response Regulation via Ubiquitination  	0.16666666666666666	0.0	0.1818181818181818	0.4215085047800995
Reactome_2022	Nephrin Family Interactions	Structural integrity and signaling in podocytes	0.0	0.0	0.0	0.5351645302403047
Reactome_2022	Nervous System Development	Ribosome Assembly and Function	0.0	0.0	0.0	0.1787351935044602
Reactome_2022	Netrin Mediated Repulsion Signals	Netrin-mediated axon guidance and cell migration  	0.5	0.3333333333333333	0.36363636363636365	0.7061145330233111
Reactome_2022	Netrin-1 Signaling	Neural development and axon guidance	0.0	0.0	0.0	0.5586868573935471
Reactome_2022	Neurexins And Neuroligins	Synaptic organization and neurotransmission regulation	0.3333333333333333	0.0	0.25	0.4724942475978896
Reactome_2022	Neurofascin Interactions	Neuronal development and synapse formation	0.0	0.0	0.0	0.4289124111721211
Reactome_2022	Neuronal System	Neurotransmission and Synaptic Regulation	0.0	0.0	0.0	0.4842622987908587
Reactome_2022	Neurotoxicity Of Clostridium Toxins	Synaptic Vesicle Cycle and Neurotransmitter Release	0.0	0.0	0.0	0.32576092442941884
Reactome_2022	Neurotransmitter Clearance	Neurotransmitter metabolism and transport	0.5	0.0	0.3333333333333333	0.6887742235337293
Reactome_2022	Neurotransmitter Receptors And Postsynaptic Signal Transmission	Synaptic Transmission and Neuromodulation	0.3333333333333333	0.0	0.2	0.6922968577083707
Reactome_2022	Neurotransmitter Release Cycle	Neurotransmitter regulation and synaptic transmission	0.3333333333333333	0.0	0.25	0.5903867295167198
Reactome_2022	Neutrophil Degranulation	Immune response and proteolytic processing	0.0	0.0	0.0	0.4512242757513647
Reactome_2022	Nicotinamide Salvaging	NAD+ Metabolism and Poly(ADP-ribose) Polymerase (PARP) Activity	0.0	0.0	0.0	0.5225860389679233
Reactome_2022	Nicotinate Metabolism	NAD Metabolism and Poly-ADP-Ribosylation	0.5	0.0	0.25	0.5009778359861211
Reactome_2022	Nitric Oxide Stimulates Guanylate Cyclase	Cyclic Nucleotide Signaling and Regulation in Germline and Smooth Muscle Cells	0.0	0.0	0.0	0.4962372261147189
Reactome_2022	NoRC Negatively Regulates rRNA Expression	Regulation of Transcription and Chromatin Remodeling	0.2	0.0	0.1818181818181818	0.43183426177190487
Reactome_2022	Non-integrin membrane-ECM Interactions	Extracellular Matrix Organization and Cell-Cell Adhesion	0.0	0.0	0.0	0.5872877022555809
Reactome_2022	Noncanonical Activation Of NOTCH3	Notch Signaling Pathway	0.0	0.0	0.0	0.5822642359734702
Reactome_2022	Nonhomologous End-Joining (NHEJ)	DNA Damage Response and Repair	0.0	0.0	0.0	0.3992016793029952
Reactome_2022	Nonsense Mediated Decay (NMD) Enhanced By Exon Junction Complex (EJC)	Ribosome Biogenesis and Nonsense-Mediated mRNA Decay	0.3	0.1111111111111111	0.3529411764705882	0.6036531953666993
Reactome_2022	Nonsense Mediated Decay (NMD) Independent Of Exon Junction Complex (EJC)	Ribosome biogenesis and assembly	0.0	0.0	0.0	0.3177717237233777
Reactome_2022	Norepinephrine Neurotransmitter Release Cycle	Synaptic Vesicle Exocytosis and Neurotransmitter Release	0.5	0.3333333333333333	0.4	0.5317636424058655
Reactome_2022	Notch-HLH Transcription Pathway	Transcriptional Regulation and Chromatin Modification	0.25	0.0	0.22222222222222224	0.40182997413440147
Reactome_2022	NrCAM Interactions	Neuronal Development and Synapse Formation	0.0	0.0	0.0	0.3631017184856111
Reactome_2022	Nuclear Envelope (NE) Reassembly	Nuclear Transport and Cytoskeletal Organization	0.25	0.0	0.22222222222222224	0.5207821308031952
Reactome_2022	Nuclear Envelope Breakdown	Nuclear pore complex assembly and function	0.3333333333333333	0.0	0.2222222222222222	0.4918745000210611
Reactome_2022	Nuclear Events (Kinase And Transcription Factor Activation)	Signal Transduction and Gene Expression Regulation via MAPK Signaling Pathway	0.14285714285714285	0.0	0.11764705882352941	0.5108967939692323
Reactome_2022	Nuclear Pore Complex (NPC) Disassembly	Regulation of nucleocytoplasmic transport during cell cycle progression	0.0	0.0	0.0	0.5214832479151653
Reactome_2022	Nuclear Receptor Transcription Pathway	Nuclear Receptor Signaling and Regulation	0.5	0.3333333333333333	0.4444444444444445	0.7496525823034215
Reactome_2022	Nuclear Events Mediated By NFE2L2	Protein Degradation and Redox Homeostasis	0.0	0.0	0.0	0.4014977878826719
Reactome_2022	Nuclear Events Stimulated By ALK Signaling In Cancer	Signal Transduction and Cell Cycle Regulation	0.125	0.0	0.14285714285714288	0.4939430320183267
Reactome_2022	Nuclear Import Of Rev Protein	Nuclear pore complex (NPC) assembly and transport	0.2	0.0	0.16666666666666666	0.454859552728458
Reactome_2022	Nuclear Signaling By ERBB4	Neuregulin-EGFR Signaling and Neural-Adhesion Modulation	0.25	0.0	0.18181818181818182	0.5618892822440024
Reactome_2022	Nucleotide Excision Repair	DNA Replication and Repair Coordination	0.3333333333333333	0.0	0.25	0.47697803965901214
Reactome_2022	Nucleotide Biosynthesis	Purine and Pyrimidine Metabolism	0.0	0.0	0.0	0.6183588586518414
Reactome_2022	Nucleotide Catabolism	Nucleotide Metabolism and Homeostasis	0.5	0.0	0.3333333333333333	0.7333857445908493
Reactome_2022	Nucleotide Salvage	Nucleotide metabolism and salvage pathways	1.0	0.0	0.5714285714285715	0.8354446960310056
Reactome_2022	Nucleotide-binding Domain, Leucine Rich Repeat Containing NLR Signaling Pathways	Innate Immune Response and Inflammatory Pathways	0.1	0.0	0.125	0.5093296467797721
Reactome_2022	Nucleotide-like (Purinergic) Receptors	Purinergic Signaling and Receptor-Mediated Responses	0.5	0.0	0.4	0.6657685030440543
Reactome_2022	O-glycosylation Of TSR Domain-Containing Proteins	Extracellular Matrix Remodeling and Developmental Processes	0.0	0.0	0.0	0.3023441721620067
Reactome_2022	O-linked Glycosylation	Mucin synthesis and glycosylation	0.3333333333333333	0.0	0.28571428571428575	0.5311669886857436
Reactome_2022	O-linked Glycosylation Of Mucins	Glycosylation and Mucin Production	0.4	0.0	0.4444444444444445	0.7304418732651787
Reactome_2022	OAS Antiviral Response	RNA Interference in Antiviral Defense	0.3333333333333333	0.0	0.25	0.517930247772972
Reactome_2022	Olfactory Signaling Pathway	Olfactory Reception and Signal Transduction	0.6666666666666666	0.0	0.5	0.7241390550439694
Reactome_2022	Oncogene Induced Senescence	Cell Cycle Regulation and Tumor Suppression	0.0	0.0	0.0	0.5072307500672697
Reactome_2022	Oncogenic MAPK Signaling	MAP Kinase (MAPK) Signaling Pathway Regulation	0.6666666666666666	0.5	0.4444444444444444	0.6439918741869326
Reactome_2022	Opioid Signaling	Signal Transduction in GPCR-mediated Pathways	0.5	0.0	0.25	0.42931068669947303
Reactome_2022	Opsins	Phototransduction and light perception	0.0	0.0	0.0	0.4798542628040586
Reactome_2022	Orc1 Removal From Chromatin	DNA replication and proteasome-mediated protein degradation	0.0	0.0	0.0	0.4329105288437913
Reactome_2022	Orexin And Neuropeptides FF And QRFP Bind To Their Respective Receptors	Neuropeptide signaling and receptor interaction	0.2727272727272727	0.0	0.37499999999999994	0.5759814001133376
Reactome_2022	Organelle Biogenesis And Maintenance	Intraflagellar Transport and Mitochondrial Dynamics	0.25	0.0	0.22222222222222224	0.49369121046764997
Reactome_2022	Organic Anion Transport	Organic anion transport and renal clearance	1.0	1.0	0.6666666666666666	0.8107399951442871
Reactome_2022	Organic Anion Transporters	Solute Transport and Metabolite Exchange	0.3333333333333333	0.0	0.25	0.43703859822269686
Reactome_2022	Organic Cation Transport	Organic cation transport and regulation	1.0	1.0	0.7499999999999999	0.9058637425254884
Reactome_2022	Organic Cation/Anion/Zwitterion Transport	Organic Cation/Anion Transport and Regulation	0.8	0.5	0.7272727272727272	0.8576246884961685
Reactome_2022	Other Interleukin Signaling	Immune modulation and inflammatory response regulation	0.0	0.0	0.0	0.439299502540496
Reactome_2022	Other Semaphorin Interactions	Semaphorin signaling and immune modulation	0.3333333333333333	0.0	0.25	0.6684606239441776
Reactome_2022	Ovarian Tumor Domain Proteases	Regulation of Ubiquitin-Mediated Innate Immune Response	0.0	0.0	0.0	0.2798147262523051
Reactome_2022	Oxidative Stress Induced Senescence	Gene expression regulation through epigenetic modification	0.0	0.0	0.0	0.29470831576174983
Reactome_2022	Oxygen-dependent Proline Hydroxylation Of Hypoxia-inducible Factor Alpha	Proteasome-mediated Protein Degradation and Hypoxia-Inducible Factor Regulation	0.3333333333333333	0.25	0.3333333333333333	0.6253502458817013
Reactome_2022	P2Y Receptors	Purinergic signaling and receptor-mediated cellular responses	0.5	0.0	0.22222222222222224	0.601570335545795
Reactome_2022	PCNA-Dependent Long Patch Base Excision Repair	DNA Replication and Repair Mechanisms	0.14285714285714285	0.0	0.16666666666666666	0.4608700861248194
Reactome_2022	PCP/CE Pathway	Proteasome-mediated Protein Degradation and Wnt Signaling Pathway Integration	0.3333333333333333	0.0	0.16666666666666666	0.3460095862056616
Reactome_2022	PD-1 Signaling	T-cell activation and immune response modulation	0.0	0.0	0.0	0.4235113019299023
Reactome_2022	PECAM1 Interactions	Signal transduction in immune cell activation and adhesion	0.0	0.0	0.0	0.3886699413411804
Reactome_2022	PERK Regulates Gene Expression	Unfolded Protein Response and mRNA Decay	0.0	0.0	0.0	0.3512911501548736
Reactome_2022	PI Metabolism	Phosphoinositide Metabolism and Regulation	0.5	0.0	0.3333333333333333	0.5055281819065123
Reactome_2022	PI-3K cascade:FGFR1	Fibroblast Growth Factor (FGF) signaling in development and metabolism  	0.0	0.0	0.0	0.4750566176521154
Reactome_2022	PI-3K cascade:FGFR2	Fibroblast Growth Factor Signaling and Receptor Activation	0.0	0.0	0.0	0.5386953223073377
Reactome_2022	PI-3K cascade:FGFR3	Fibroblast Growth Factor Signaling and Regulation	0.0	0.0	0.0	0.5015927979286472
Reactome_2022	PI-3K cascade:FGFR4	Fibroblast Growth Factor signaling and regulation	0.0	0.0	0.0	0.510673262857783
Reactome_2022	PI3K Cascade	** Fibroblast Growth Factor Signaling and Its Downstream Effects  	0.0	0.0	0.0	0.41955731617090286
Reactome_2022	PI3K Events In ERBB2 Signaling	EGF signaling and receptor interaction	0.2	0.0	0.20000000000000004	0.5128085746826574
Reactome_2022	PI3K Events In ERBB4 Signaling	Epidermal Growth Factor Receptor (EGFR) Signaling	0.2	0.0	0.1818181818181818	0.5917879365247123
Reactome_2022	PI3K/AKT Signaling In Cancer	Growth factor signaling network and cell fate regulation  	0.2	0.0	0.15384615384615385	0.4760315045485071
Reactome_2022	PI3K/AKT Activation	Neurotrophic signaling and intracellular signaling pathways	0.0	0.0	0.0	0.4589533691230412
Reactome_2022	PI5P Regulates TP53 Acetylation	Phosphoinositide-mediated signaling and chromatin remodeling	0.0	0.0	0.0	0.536279628503774
Reactome_2022	PI5P, PP2A And IER3 Regulate PI3K/AKT Signaling	Growth factor signaling and receptor tyrosine kinase-mediated pathways	0.25	0.0	0.11764705882352941	0.45068002335362856
Reactome_2022	PINK1-PRKN Mediated Mitophagy	Mitochondrial Quality Control and Mitophagy	0.25	0.0	0.22222222222222224	0.6469833869942103
Reactome_2022	PIP3 Activates AKT Signaling	Protein degradation and cellular signaling modulation	0.25	0.0	0.2	0.40937738874166685
Reactome_2022	PIWI-interacting RNA (piRNA) Biogenesis	PiRNA Biogenesis and Transposon Silencing	0.4	0.25	0.4000000000000001	0.6475198764902306
Reactome_2022	PKA Activation	Adenylate Cyclase and Protein Kinase A Signaling	0.0	0.0	0.0	0.43370784943122986
Reactome_2022	PKA Activation In Glucagon Signaling	cAMP signaling cascade	0.2	0.0	0.25	0.3643233674370466
Reactome_2022	PKA-mediated Phosphorylation Of CREB	cAMP Signaling and Protein Kinase A Pathway Regulation	0.0	0.0	0.0	0.5457951050324585
Reactome_2022	PKA-mediated Phosphorylation Of Key Metabolic Factors	Regulation of Glucose Metabolism	0.2857142857142857	0.0	0.36363636363636365	0.4526728441340615
Reactome_2022	PKMTs Methylate Histone Lysines	Chromatin modification and gene regulation	0.0	0.0	0.0	0.43727328439657814
Reactome_2022	PLC Beta Mediated Events	cAMP Signaling and Calcium Signaling Crosstalk	0.0	0.0	0.0	0.3775786100023615
Reactome_2022	POLB-Dependent Long Patch Base Excision Repair	DNA Repair and Maintenance	0.14285714285714285	0.0	0.18181818181818182	0.5086071796652514
Reactome_2022	POU5F1 (OCT4), SOX2, NANOG Activate Genes Related To Proliferation	Stem cell regulation and maintenance	0.0	0.0	0.0	0.47354569457162204
Reactome_2022	POU5F1 (OCT4), SOX2, NANOG Repress Genes Related To Differentiation	Early Embryonic Development and Germ Layer Specification	0.0	0.0	0.0	0.39818008118021214
Reactome_2022	PP2A-mediated Dephosphorylation Of Key Metabolic Factors	Regulation of glucose metabolism and energy homeostasis	0.2857142857142857	0.0	0.2857142857142857	0.4510725319724246
Reactome_2022	PPARA Activates Gene Expression	Transcriptional Regulation and Lipid Metabolism	0.0	0.0	0.0	0.44809816512567546
Reactome_2022	PRC2 Methylates Histones And DNA	Epigenetic Regulation and Chromatin Modification	0.2	0.0	0.20000000000000004	0.5442950473695086
Reactome_2022	PTEN Regulation	Protein Degradation and Cellular Regulation	0.5	0.0	0.28571428571428575	0.449862962108855
Reactome_2022	PTK6 Expression	Hypoxia Response and Cellular Adaptation	0.0	0.0	0.0	0.2274026088970213
Reactome_2022	PTK6 Regulates Cell Cycle	Cell Cycle Regulation and Progression	0.75	0.3333333333333333	0.4444444444444445	0.563765816637822
Reactome_2022	PTK6 Regulates RHO GTPases, RAS GTPase And MAP Kinases	Regulation of Actin Cytoskeleton Dynamics	0.1111111111111111	0.0	0.14285714285714285	0.4970102748041753
Reactome_2022	PTK6 Regulates RTKs And Their Effectors AKT1 And DOK1	Protein Ubiquitination and Signal Transduction	0.1111111111111111	0.0	0.14285714285714285	0.3602726534648481
Reactome_2022	PTK6 Promotes HIF1A Stabilization	Cellular response to hypoxia and growth signal modulation	0.0	0.0	0.0	0.48100216349664326
Reactome_2022	Packaging Of Telomere Ends	Chromatin Structure and Telomere Maintenance	0.25	0.0	0.22222222222222224	0.5911649099487536
Reactome_2022	Paracetamol ADME	Xenobiotic metabolism and detoxification  	0.0	0.0	0.0	0.30230643781145566
Reactome_2022	Paradoxical Activation Of RAF Signaling By Kinase Inactive BRAF	Signal Transduction and Cytoskeletal Regulation in Hemostasis	0.1111111111111111	0.0	0.125	0.3347934368070512
Reactome_2022	Passive Transport By Aquaporins	Regulation and Transport of Water and Glycerol	0.25	0.0	0.18181818181818182	0.46554136313110095
Reactome_2022	Pausing And Recovery Of Tat-mediated HIV Elongation	Transcription Elongation and Regulation	0.25	0.0	0.16666666666666666	0.5200300366663313
Reactome_2022	Pentose Phosphate Pathway	Pentose phosphate pathway and nucleotide biosynthesis  	1.0	1.0	0.6666666666666666	0.7810720554337336
Reactome_2022	Peptide Chain Elongation	Ribosome biogenesis and function	0.0	0.0	0.0	0.3152847225803923
Reactome_2022	Peptide Hormone Biosynthesis	Hormonal regulation and reproductive endocrinology	0.3333333333333333	0.0	0.25	0.34292416480060817
Reactome_2022	Peptide Hormone Metabolism	Hormonal regulation and exocytosis in the endocrine system	0.3333333333333333	0.0	0.18181818181818182	0.4766738629674492
Reactome_2022	Peptide Ligand-Binding Receptors	Neuropeptide signaling and receptor interaction	0.25	0.0	0.22222222222222224	0.622135488017713
Reactome_2022	Peroxisomal Lipid Metabolism	Peroxisomal fatty acid β-oxidation	0.3333333333333333	0.0	0.28571428571428575	0.8065990048055389
Reactome_2022	Peroxisomal Protein Import	Peroxisomal Beta-Oxidation and Metabolic Processing	0.3333333333333333	0.0	0.2222222222222222	0.5895072885267016
Reactome_2022	Pexophagy	Regulation of Autophagy and Selective Protein Degradation	0.0	0.0	0.0	0.3309082927732677
Reactome_2022	Phase 0 - Rapid Depolarisation	Voltage-Gated Ion Channel Regulation and Signaling	0.0	0.0	0.0	0.36599321782247446
Reactome_2022	Phase 1 - Inactivation Of Fast Na+ Channels	Voltage-gated potassium channel regulation	0.14285714285714285	0.0	0.16666666666666666	0.44076452369825847
Reactome_2022	Phase 2 - Plateau Phase	Cardiac Action Potential Modulation	0.0	0.0	0.0	0.27054271297550453
Reactome_2022	Phase 3 - Rapid Repolarisation	Modulation of cardiac potassium ion channels 	0.0	0.0	0.0	0.3613582891535977
Reactome_2022	Phase 4 - Resting Membrane Potential	Potassium ion channel regulation	0.0	0.0	0.0	0.432761877515077
Reactome_2022	Phase I - Functionalization Of Compounds	Xenobiotic Metabolism and Detoxification	0.0	0.0	0.0	0.3825514670869839
Reactome_2022	Phase II - Conjugation Of Compounds	Xenobiotic Metabolism and Detoxification	0.0	0.0	0.0	0.4532479062284493
Reactome_2022	Phenylalanine And Tyrosine Metabolism	Phenylalanine and Tyrosine Metabolism	1.0	1.0	1.0	0.9999988493592982
Reactome_2022	Phenylalanine Metabolism	Tetrahydrobiopterin (BH4) metabolism	0.5	0.0	0.4	0.5769292376623937
Reactome_2022	Phosphate Bond Hydrolysis By NTPDase Proteins	Nucleotide and energy homeostasis	0.0	0.0	0.0	0.46608375546232506
Reactome_2022	Phosphate Bond Hydrolysis By NUDT Proteins	NAD metabolism regulation 	0.0	0.0	0.0	0.37404495047773206
Reactome_2022	Phospholipase C-mediated Cascade: FGFR1	Fibroblast Growth Factor Signaling and Function	0.0	0.0	0.0	0.5330761455668931
Reactome_2022	Phospholipase C-mediated Cascade; FGFR2	Fibroblast Growth Factor Signaling in Development and Tissue Repair	0.0	0.0	0.0	0.4922003115045835
Reactome_2022	Phospholipase C-mediated Cascade; FGFR3	Fibroblast growth factor signaling and tissue development	0.0	0.0	0.0	0.5155833815169975
Reactome_2022	Phospholipase C-mediated Cascade; FGFR4	Fibroblast Growth Factor Signaling Pathway	0.0	0.0	0.0	0.580612869995542
Reactome_2022	Phospholipid Metabolism	Phosphoinositide Metabolism and Lipid Signaling 	0.5	0.0	0.28571428571428575	0.7163149025445983
Reactome_2022	Phosphorylation Of CD3 And TCR Zeta Chains	T-cell activation and immune response	0.14285714285714285	0.0	0.15384615384615383	0.4597570559584943
Reactome_2022	Phosphorylation Of Emi1	Regulation of Cell Cycle and Mitosis  	0.3333333333333333	0.0	0.2222222222222222	0.4134276996418139
Reactome_2022	Phosphorylation Of APC/C	Mitotic Spindle Checkpoint and Ubiquitin-Mediated Proteolysis	0.0	0.0	0.0	0.4857653489705237
Reactome_2022	Physiological Factors	Cardiovascular Development and Function	0.0	0.0	0.0	0.3120463669405096
Reactome_2022	Plasma Lipoprotein Assembly	Lipid and cholesterol metabolism and transport	0.0	0.0	0.0	0.5530103752539525
Reactome_2022	Plasma Lipoprotein Assembly, Remodeling, And Clearance	Lipid Metabolism and Regulation	0.16666666666666666	0.0	0.2	0.5582361491635067
Reactome_2022	Plasma Lipoprotein Clearance	Lipoprotein metabolism and cholesterol homeostasis	0.3333333333333333	0.0	0.25	0.6144347971928361
Reactome_2022	Plasma Lipoprotein Remodeling	Lipid metabolism and transport	0.0	0.0	0.0	0.566665339524951
Reactome_2022	Platelet Adhesion To Exposed Collagen	Platelet adhesion and signaling	0.4	0.25	0.4444444444444445	0.7184646968611808
Reactome_2022	Platelet Aggregation (Plug Formation)	Platelet Activation and Aggregation	0.5	0.0	0.5	0.7344189718899279
Reactome_2022	Platelet Activation, Signaling And Aggregation	Platelet Activation and Aggregation	0.8	0.5	0.888888888888889	0.8686226027361269
Reactome_2022	Platelet Calcium Homeostasis	Calcium signaling and homeostasis	0.6666666666666666	0.0	0.5714285714285715	0.6641450622267142
Reactome_2022	Platelet Degranulation	Platelet aggregation and clot formation	0.5	0.0	0.28571428571428575	0.562674949369049
Reactome_2022	Platelet Homeostasis	Cellular Signal Transduction and Calcium Homeostasis	0.5	0.0	0.25	0.41601508846046453
Reactome_2022	Platelet Sensitization By LDL	Protein Phosphatase 2A Assembly and Regulation	0.0	0.0	0.0	0.24570060742830044
Reactome_2022	Polo-like Kinase Mediated Events	Cell Cycle Regulation and Mitosis Control	0.0	0.0	0.0	0.4154231865762508
Reactome_2022	Polymerase Switching On C-strand Of Telomere	Telomere Maintenance and DNA Replication	0.14285714285714285	0.0	0.16666666666666666	0.5519191494128867
Reactome_2022	Positive Epigenetic Regulation Of rRNA Expression	** Chromatin Dynamics and Transcription Regulation	0.16666666666666666	0.0	0.1818181818181818	0.5035887755515702
Reactome_2022	Post NMDA Receptor Activation Events	Synaptic Plasticity and Signal Transduction	0.0	0.0	0.0	0.44247580601247294
Reactome_2022	Post-chaperonin Tubulin Folding Pathway	Microtubule Dynamics and Assembly	0.0	0.0	0.0	0.477422799667633
Reactome_2022	Post-transcriptional Silencing By Small RNAs	RNA-Induced Silencing Complex (RISC)-Mediated Gene Regulation	0.3333333333333333	0.0	0.14285714285714288	0.6719120841478889
Reactome_2022	Post-translational Modification: Synthesis Of GPI-anchored Proteins	GPI-anchor biosynthesis and related glycosylation processes	0.25	0.14285714285714285	0.26666666666666666	0.7379600993445989
Reactome_2022	Post-translational Protein Modification	Proteasome-mediated protein degradation and protein quality control	0.25	0.0	0.16666666666666666	0.4819239710992152
Reactome_2022	Post-translational Protein Phosphorylation	Extracellular Matrix Interaction and Regulation	0.0	0.0	0.0	0.3397492299505418
Reactome_2022	Postmitotic Nuclear Pore Complex (NPC) Reformation	Nuclear Pore Complex Assembly and Nuclear Transport	0.5	0.4	0.4615384615384615	0.6530974617077541
Reactome_2022	Potassium Channels	Ion Channel Regulation and Signal Transduction	0.5	0.0	0.25	0.4947834001933878
Reactome_2022	Potential Therapeutics For SARS	Immune signaling and regulation	0.0	0.0	0.0	0.2327406034031244
Reactome_2022	Pre-NOTCH Expression And Processing	Chromatin remodeling and gene regulation	0.2	0.0	0.20000000000000004	0.15201900458581896
Reactome_2022	Pre-NOTCH Processing In Golgi	Notch-mediated signaling and glycosylation regulation	0.2	0.0	0.1818181818181818	0.4721742002333829
Reactome_2022	Pre-NOTCH Processing In Endoplasmic Reticulum	Notch Signaling Pathway	0.16666666666666666	0.0	0.2222222222222222	0.38529748087544213
Reactome_2022	Pre-NOTCH Transcription And Translation	Chromatin remodeling and transcription regulation	0.4	0.0	0.20000000000000004	0.39329299864315526
Reactome_2022	Prefoldin Mediated Transfer Of Substrate To CCT/TriC	Cytoskeletal Dynamics and Protein Folding	0.0	0.0	0.0	0.48879286043953596
Reactome_2022	Pregnenolone Biosynthesis	Steroidogenesis and cholesterol transport	0.0	0.0	0.0	0.5699637614939908
Reactome_2022	Presynaptic Depolarization And Calcium Channel Opening	Calcium Channel Modulation and Synaptic Transmission	0.5	0.2	0.3333333333333333	0.5932612044441237
Reactome_2022	Presynaptic Function Of Kainate Receptors	G-protein signaling and phosphoinositide signaling pathway	0.0	0.0	0.0	0.25743206829256116
Reactome_2022	Presynaptic Nicotinic Acetylcholine Receptors	Nicotinic Acetylcholine Receptor Signalling	0.75	0.6666666666666666	0.75	0.6850889736702953
Reactome_2022	Presynaptic Phase Of Homologous DNA Pairing And Strand Exchange	DNA Damage Response and Repair	0.2222222222222222	0.0	0.2857142857142857	0.3443059406843751
Reactome_2022	Prevention Of Phagosomal-Lysosomal Fusion	Endosomal Sorting and Protein Degradation	0.0	0.0	0.0	0.4424567593397203
Reactome_2022	Processing And Activation Of SUMO	SUMOylation and SUMO Cycle Regulation	0.4	0.0	0.4000000000000001	0.7026058519217644
Reactome_2022	Processing Of Capped Intron-Containing Pre-mRNA	** RNA Processing and Transport  	0.14285714285714285	0.0	0.18181818181818182	0.5145708476449757
Reactome_2022	Processing Of Capped Intronless Pre-mRNA	Pre-mRNA processing and regulation	0.5	0.2	0.3636363636363636	0.6546254972056823
