library	gt_name	gsai_name	gsai_ROUGE1	gsai_ROUGE2	gsai_ROUGEL	gsai_csim
Reactome_2022	Translation	Ribosome biogenesis and translation	1.0	0.0	0.4	0.3066667449377544
Reactome_2022	Translation Initiation Complex Formation	Translation Initiation and Ribosome Assembly	0.5	0.3333333333333333	0.4444444444444445	0.7772894352687314
Reactome_2022	Translation Of Replicase And Assembly Of Replication Transcription Complex	Autophagy and Endosomal Sorting	0.1111111111111111	0.0	0.15384615384615383	0.25856270406998055
Reactome_2022	Translation Of Structural Proteins	Glycosylation and Protein Modification in ER and Golgi	0.25	0.0	0.16666666666666666	0.33959952649253355
Reactome_2022	Translesion Synthesis By POLH	DNA Replication and Repair	0.0	0.0	0.0	0.4122110577913564
Reactome_2022	Translesion Synthesis By POLI	DNA replication and repair	0.0	0.0	0.0	0.44492357510591807
Reactome_2022	Translesion Synthesis By POLK	DNA Replication and Damage Tolerance	0.0	0.0	0.0	0.5490900065983617
Reactome_2022	Translesion Synthesis By REV1	DNA Replication and Repair	0.0	0.0	0.0	0.449594024884447
Reactome_2022	Translesion Synthesis By Y Family DNA Polymerases Bypasses Lesions On DNA Template	** DNA replication and repair mechanisms  	0.08333333333333333	0.0	0.11764705882352941	0.4503811998387485
Reactome_2022	Translocation Of SLC2A4 (GLUT4) To Plasma Membrane	Regulation of vesicle-mediated transport and glucose metabolism	0.14285714285714285	0.0	0.13333333333333333	0.5223709613828643
Reactome_2022	Translocation Of ZAP-70 To Immunological Synapse	T-Cell Activation and Antigen Presentation	0.0	0.0	0.0	0.45412482485777234
Reactome_2022	Transmission Across Chemical Synapses	Synaptic transmission and plasticity	0.25	0.0	0.25	0.6084392538618022
Reactome_2022	Transport And Synthesis Of PAPS	Sulfate Transport and Sulfation Pathways	0.4	0.25	0.4000000000000001	0.5813655004703777
Reactome_2022	Transport Of Mature Transcript To Cytoplasm	mRNA Export and Splicing	0.0	0.0	0.0	0.5875666641222833
Reactome_2022	Transport Of Mature mRNA Derived From An Intronless Transcript	Nuclear Pore Complex (NPC) Assembly and mRNA Export	0.1111111111111111	0.0	0.11764705882352941	0.5221132285236492
Reactome_2022	Transport Of Mature mRNA Derived From An Intron-Containing Transcript	RNA Transport and Processing	0.1	0.0	0.14285714285714288	0.5118855246473624
Reactome_2022	Transport Of Mature mRNAs Derived From Intronless Transcripts	Nuclear Pore Complex Assembly and mRNA Export	0.125	0.0	0.13333333333333333	0.5506267408760455
Reactome_2022	Transport Of RCbl Within Body	Vitamin B12 transport and cellular uptake	0.2	0.0	0.1818181818181818	0.5546075561427886
Reactome_2022	Transport Of Ribonucleoproteins Into Host Nucleus	Nuclear Pore Complex Assembly and Function	0.0	0.0	0.0	0.4799349278528168
Reactome_2022	Transport Of Bile Salts And Organic Acids, Metal Ions And Amine Compounds	Solute transport across cellular membranes	0.08333333333333333	0.0	0.11764705882352941	0.4555476011213517
Reactome_2022	Transport Of Fatty Acids	Lipid transport and metabolism	0.25	0.0	0.25	0.6285034585781577
Reactome_2022	Transport Of Gamma-Carboxylated Protein Precursors From Endoplasmic Reticulum To Golgi Apparatus	Blood Coagulation and Anti-coagulation Regulation	0.0	0.0	0.0	0.35542691211825156
Reactome_2022	Transport Of Inorganic Cations/Anions And Amino Acids/Oligopeptides	Solute Transport and Exchange	0.2222222222222222	0.0	0.30769230769230765	0.5528453209741413
Reactome_2022	Transport Of Nucleosides And Free Purine And Pyrimidine Bases Across Plasma Membrane	Nucleotide and Mitochondrial Metabolite Transport	0.16666666666666666	0.0	0.11764705882352941	0.6216732276463891
Reactome_2022	Transport Of Nucleotide Sugars	Nucleotide sugar transport and glycosylation	0.75	0.3333333333333333	0.4444444444444445	0.8230920023793702
Reactome_2022	Transport Of Organic Anions	Organic anion transporting polypeptides (OATP) and monocarboxylate transporters (MCT) mediated substance transport	0.75	0.3333333333333333	0.25	0.6763260886442404
Reactome_2022	Transport Of Small Molecules	Membrane Transport and Cellular Homeostasis	0.25	0.0	0.22222222222222224	0.5496272799764312
Reactome_2022	Transport Of SLBP Dependant Mature mRNA	Nuclear Transport and RNA Processing	0.16666666666666666	0.0	0.1818181818181818	0.5347082444715587
Reactome_2022	Transport Of SLBP Independent Mature mRNA	Nuclear Pore Complex Formation and Function	0.0	0.0	0.0	0.2922052562010698
Reactome_2022	Transport Of Vitamins, Nucleosides, And Related Molecules	Solute transport and homeostasis	0.2857142857142857	0.0	0.36363636363636365	0.47984458146284603
Reactome_2022	Transport To Golgi And Subsequent Modification	Intracellular Trafficking and Glycosylation	0.16666666666666666	0.0	0.2	0.670379477899702
Reactome_2022	Triglyceride Biosynthesis	Triglyceride Biosynthesis and Lipid Metabolism	1.0	1.0	0.5714285714285715	0.8672814102688666
Reactome_2022	Triglyceride Catabolism	Lipid metabolism and energy regulation	0.0	0.0	0.0	0.5556716268402659
Reactome_2022	Triglyceride Metabolism	Lipid Metabolism and Storage	0.5	0.0	0.3333333333333333	0.6925419744221001
Reactome_2022	Tristetraprolin (TTP, ZFP36) Binds And Destabilizes mRNA	mRNA Decay and Turnover	0.2857142857142857	0.0	0.18181818181818182	0.49794775216625076
Reactome_2022	Tryptophan Catabolism	Tryptophan Metabolism and Kynurenine Pathway	0.5	0.0	0.28571428571428575	0.705437527912112
Reactome_2022	Type I Hemidesmosome Assembly	Basal Membrane Adhesion and Integrity	0.0	0.0	0.0	0.5528561696924392
Reactome_2022	Tyrosine Catabolism	Tyrosine Metabolism and Homeostasis	0.5	0.0	0.3333333333333333	0.7744967901864557
Reactome_2022	UCH Proteinases	Proteasome complex regulation and ubiquitin-proteasome pathway	0.0	0.0	0.0	0.4138588844761051
Reactome_2022	Ub-specific Processing Proteases	Proteasome-mediated proteolysis and ubiquitination	0.0	0.0	0.0	0.5545443648822924
Reactome_2022	Ubiquinol Biosynthesis	Coenzyme Q10 (CoQ10) Biosynthesis and Function	0.5	0.0	0.25	0.6848611726676672
Reactome_2022	Ubiquitin Mediated Degradation Of Phosphorylated Cdc25A	Protein Degradation via the Ubiquitin-Proteasome Pathway	0.3333333333333333	0.0	0.15384615384615383	0.5296973502890624
Reactome_2022	Ubiquitin-dependent Degradation Of Cyclin D	Protein Degradation via the Proteasome	0.16666666666666666	0.0	0.1818181818181818	0.5452282823200529
Reactome_2022	Unblocking Of NMDA Receptors, Glutamate Binding And Activation	Synaptic signaling and plasticity	0.125	0.0	0.16666666666666666	0.3729910086064826
Reactome_2022	Unfolded Protein Response (UPR)	Unfolded Protein Response and ER Stress Response	0.75	0.6666666666666666	0.5454545454545454	0.8126335247074279
Reactome_2022	Unwinding Of DNA	DNA Replication Initiation and Helicase Activity	0.3333333333333333	0.0	0.2222222222222222	0.5101564023841256
Reactome_2022	Uptake And Actions Of Bacterial Toxins	Intracellular Signaling and Exocytosis Regulation	0.16666666666666666	0.0	0.1818181818181818	0.37166117621452255
Reactome_2022	Uptake And Function Of Anthrax Toxins	Mitogen-Activated Protein Kinase (MAPK) Cascade Regulation	0.0	0.0	0.0	0.20745468573381468
Reactome_2022	Uptake And Function Of Diphtheria Toxin	Protein Folding and Cellular Stress Response	0.16666666666666666	0.0	0.16666666666666666	0.2909488502636587
Reactome_2022	Uptake Of Dietary Cobalamins Into Enterocytes	Vitamin B12 absorption and processing	0.0	0.0	0.0	0.6208226442530553
Reactome_2022	Urea Cycle	Urea Cycle and Nitrogen Metabolism	1.0	1.0	0.5714285714285715	0.8260695713606165
Reactome_2022	VEGF Binds To VEGFR Leading To Receptor Dimerization	Vascular Endothelial Growth Factor Signaling and Angiogenesis	0.0	0.0	0.0	0.597319500902276
Reactome_2022	VEGFA-VEGFR2 Pathway	Regulation of actin cytoskeleton and signal transduction	0.0	0.0	0.0	0.33635747800907834
Reactome_2022	VEGFR2 Mediated Cell Proliferation	Calcium Signaling Pathway Modulation	0.0	0.0	0.0	0.34933473031719986
Reactome_2022	VEGFR2 Mediated Vascular Permeability	PI3K/AKT/mTOR Signaling Pathway	0.0	0.0	0.0	0.34739569914362256
Reactome_2022	VLDL Clearance	Lipid transport and metabolism	0.0	0.0	0.0	0.43869377695720535
Reactome_2022	VLDLR Internalisation And Degradation	Clathrin-mediated endocytosis and lipid metabolism regulation	0.25	0.0	0.18181818181818182	0.4940594533505349
Reactome_2022	Vasopressin Regulates Renal Water Homeostasis Via Aquaporins	G-protein-mediated signal transduction and cAMP regulation	0.14285714285714285	0.0	0.13333333333333333	0.33380458199995544
Reactome_2022	Vasopressin-like Receptors	Oxytocin and Vasopressin Signaling Pathways	0.3333333333333333	0.0	0.25	0.632371845272825
Reactome_2022	Vesicle-mediated Transport	Membrane Trafficking and Dynamics	0.0	0.0	0.0	0.589712142262651
Reactome_2022	Vif-mediated Degradation Of APOBEC3G	Proteasome-mediated proteolysis	0.2	0.0	0.25	0.454632563137672
Reactome_2022	Viral Messenger RNA Synthesis	Nuclear pore complex and RNA polymerase II transcription complex	0.25	0.0	0.15384615384615383	0.3899160932626974
Reactome_2022	Viral mRNA Translation	Ribosome Biogenesis and Function	0.0	0.0	0.0	0.34376441296122695
Reactome_2022	Virus Assembly And Release	Protein folding and cellular trafficking	0.25	0.0	0.22222222222222224	0.4168805259327433
Reactome_2022	Visual Phototransduction	Visual Signal Transduction and Retinoid Metabolism	0.5	0.0	0.25	0.6865835531887179
Reactome_2022	Vitamin B1 (Thiamin) Metabolism	Thiamine metabolism and transport	0.5	0.3333333333333333	0.5	0.7542346351894136
Reactome_2022	Vitamin B2 (Riboflavin) Metabolism	Riboflavin metabolism and transport	0.5	0.3333333333333333	0.5	0.770164496735231
Reactome_2022	Vitamin B5 (Pantothenate) Metabolism	Coenzyme A Biosynthesis and Regulation	0.0	0.0	0.0	0.5462327149504833
Reactome_2022	Vitamin C (Ascorbate) Metabolism	Cellular redox homeostasis and membrane transport	0.0	0.0	0.0	0.39652162816893405
Reactome_2022	Vitamin D (Calciferol) Metabolism	Vitamin D Metabolism and Signaling	0.75	0.3333333333333333	0.6666666666666665	0.804641949078383
Reactome_2022	Vitamins	Vitamin D metabolism and retinoic acid catabolism	1.0	0.0	0.25	0.34792476381495296
Reactome_2022	Voltage Gated Potassium Channels	Potassium Channel Regulation	0.5	0.3333333333333333	0.5714285714285715	0.6404560009324693
Reactome_2022	Vpr-mediated Nuclear Import Of PICs	Nuclear pore complex assembly and function	0.16666666666666666	0.0	0.16666666666666666	0.3745763099983427
Reactome_2022	Vpu Mediated Degradation Of CD4	Proteasome-mediated degradation and protein quality control	0.4	0.25	0.3333333333333333	0.46462987777875214
Reactome_2022	VxPx Cargo-Targeting To Cilium	Vesicle Transport and Exocytosis	0.0	0.0	0.0	0.3509660035206113
Reactome_2022	WNT Ligand Biogenesis And Trafficking	WNT signaling pathway regulation	0.2	0.0	0.22222222222222224	0.6390518440816788
Reactome_2022	WNT Mediated Activation Of DVL	Wnt/β-catenin Signaling Pathway Regulation	0.2	0.0	0.20000000000000004	0.5549187812404388
Reactome_2022	WNT5A-dependent Internalization Of FZD2, FZD5 And ROR2	Clathrin-Mediated Endocytosis (CME) and Signal Transduction	0.125	0.0	0.13333333333333333	0.42236814774113285
Reactome_2022	WNT5A-dependent Internalization Of FZD4	Clathrin-mediated endocytosis and Wnt signaling	0.0	0.0	0.0	0.627956975695497
Reactome_2022	Wax And Plasmalogen Biosynthesis	Ether lipid biosynthesis and fatty acid metabolism	0.5	0.0	0.18181818181818182	0.6053810128585119
Reactome_2022	XBP1(S) Activates Chaperone Genes	** Endoplasmic Reticulum Stress Response and Protein Folding	0.0	0.0	0.0	0.5229944542631633
Reactome_2022	Xenobiotics	Xenobiotic Metabolism and Detoxification	1.0	0.0	0.4	0.6578000462251501
Reactome_2022	YAP1- And WWTR1 (TAZ)-stimulated Gene Expression	Cardiac development and remodeling	0.14285714285714285	0.0	0.18181818181818182	0.2880540124233174
Reactome_2022	ZBP1(DAI) Mediated Induction Of Type I IFNs	Innate Immune Response and NF-kB Signaling	0.0	0.0	0.0	0.4926920130679035
Reactome_2022	Zinc Efflux And Compartmentalization By SLC30 Family	Zinc Transport and Homeostasis	0.2857142857142857	0.0	0.36363636363636365	0.665798888981138
Reactome_2022	Zinc Influx Into Cells By SLC39 Gene Family	Zinc Transport and Homeostasis	0.125	0.0	0.16666666666666666	0.6234503389067783
Reactome_2022	Zinc Transporters	Zinc homeostasis and transport	1.0	0.0	0.6666666666666666	0.8064767511830212
Reactome_2022	Activated TAK1 Mediates P38 MAPK Activation	Activation of the NF-κB Signaling Pathway	0.16666666666666666	0.0	0.15384615384615383	0.5191334619584892
Reactome_2022	Alpha-Linolenic (Omega3) And Linoleic (Omega6) Acid Metabolism	Very-long-chain fatty acid metabolism	0.25	0.14285714285714285	0.28571428571428575	0.560458340406566
Reactome_2022	cGMP Effects	Cyclic Nucleotide Signaling and Ion Channel Regulation	0.0	0.0	0.0	0.4957689442691102
Reactome_2022	eNOS Activation	Regulation of nitric oxide signaling and cellular response	0.0	0.0	0.0	0.3000604703446532
Reactome_2022	mRNA 3-End Processing	mRNA Processing and Splicing	0.5	0.0	0.5	0.7497869062007956
Reactome_2022	mRNA Capping	Transcription Regulation and mRNA Capping	1.0	1.0	0.5714285714285715	0.7611119861591472
Reactome_2022	mRNA Editing	RNA Editing and DNA Cytosine Deamination	0.5	0.0	0.25	0.5196546615482149
Reactome_2022	mRNA Splicing - Major Pathway	mRNA processing and splicing	0.5	0.0	0.5	0.7404492554687458
Reactome_2022	mRNA Splicing - Minor Pathway	Pre-mRNA Splicing and RNA Polymerase II Transcription 	0.5	0.3333333333333333	0.3333333333333333	0.5646116995481341
Reactome_2022	mRNA Splicing	Pre-mRNA Splicing and RNA Processing Mechanisms	1.0	1.0	0.4444444444444445	0.6769166619102136
Reactome_2022	mRNA Decay By 3 To 5 Exoribonuclease	RNA processing and degradation	0.0	0.0	0.0	0.5900409331494572
Reactome_2022	mRNA Decay By 5 To 3 Exoribonuclease	mRNA Decay and Processing	0.2857142857142857	0.16666666666666666	0.36363636363636365	0.7367007785651707
Reactome_2022	mTORC1-mediated Signaling	Regulation of mTORC1 signaling and translation	0.6666666666666666	0.0	0.4444444444444444	0.6226905500485683
Reactome_2022	Mitochondrial Fatty Acid Beta-Oxidation Of Saturated Fatty Acids	Mitochondrial fatty acid beta-oxidation	0.5555555555555556	0.5	0.7142857142857143	0.8754560904712575
Reactome_2022	Mitochondrial Fatty Acid Beta-Oxidation Of Unsaturated Fatty Acids	Fatty Acid Beta-oxidation	0.4444444444444444	0.375	0.6153846153846153	0.7538153412785424
Reactome_2022	p130Cas Linkage To MAPK Signaling For Integrins	Hemostasis and Cell Adhesion	0.0	0.0	0.0	0.3693076406277038
Reactome_2022	p38MAPK Events	RAS/MAPK signaling pathway regulation	0.0	0.0	0.0	0.5817152954525882
Reactome_2022	p53-Dependent G1 DNA Damage Response	Proteasome-mediated protein degradation and cell cycle regulation	0.0	0.0	0.0	0.4126989327602918
Reactome_2022	P75 NTR Receptor-Mediated Signaling	Rho GTPase-mediated signaling	0.4	0.25	0.4444444444444445	0.5353995685347545
Reactome_2022	p75NTR Negatively Regulates Cell Cycle Via SC1	Neural Growth and Differentiation Regulation	0.14285714285714285	0.0	0.16666666666666666	0.440170258754352
Reactome_2022	p75NTR Recruits Signaling Complexes	Ubiquitin-mediated signaling and neurotrophic factor response	0.25	0.0	0.18181818181818182	0.510866107017389
Reactome_2022	p75NTR Regulates Axonogenesis	Axonal Growth and Guidance Regulation	0.3333333333333333	0.0	0.25	0.5972039410877342
Reactome_2022	p75NTR Signals Via NF-kB	NF-κB Signaling Pathway and Cellular Stress Response	0.4	0.0	0.15384615384615385	0.562325869711942
Reactome_2022	rRNA Modification In Mitochondrion	Mitochondrial ribosome assembly and maintenance	0.0	0.0	0.0	0.6048246167234747
Reactome_2022	rRNA Modification In Nucleus And Cytosol	Ribosome biogenesis	0.0	0.0	0.0	0.5041412580835882
Reactome_2022	rRNA Processing	Ribosome biogenesis and assembly	0.0	0.0	0.0	0.47968571801326376
Reactome_2022	rRNA Processing In Mitochondrion	Mitochondrial RNA processing and modification	0.25	0.0	0.22222222222222224	0.8164224065651535
Reactome_2022	rRNA Processing In Nucleus And Cytosol	Ribosome Biogenesis and Assembly	0.16666666666666666	0.0	0.2	0.5264789488232167
Reactome_2022	tRNA Aminoacylation	Cytoplasmic and Mitochondrial Aminoacyl-tRNA Synthesis	1.0	0.0	0.25	0.6345597611119733
Reactome_2022	tRNA Modification In Mitochondrion	Mitochondrial RNA Modification and Processing	0.25	0.0	0.22222222222222224	0.7731727101532029
Reactome_2022	tRNA Modification In Nucleus And Cytosol	tRNA Modification and Processing	0.5	0.2	0.6	0.7729657061369708
Reactome_2022	tRNA Processing	RNA modification and nuclear pore complex function	0.0	0.0	0.0	0.4185665898304101
Reactome_2022	tRNA Processing In Mitochondrion	Mitochondrial RNA Processing	0.25	0.0	0.28571428571428575	0.7952633983970903
Reactome_2022	tRNA Processing In Nucleus	Nucleocytoplasmic transport and RNA processing	0.25	0.0	0.22222222222222224	0.5925225289689106
Reactome_2022	trans-Golgi Network Vesicle Budding	Clathrin-mediated endocytosis	0.0	0.0	0.0	0.4081825733257731
Reactome_2022	vRNP Assembly	Protein Folding and Nuclear Transport Regulation	0.0	0.0	0.0	0.37835513957747435
WikiPathway_2023_Human	Glutathione Metabolism	Glutathione metabolism and antioxidant defense	1.0	1.0	0.5714285714285715	0.86142987379709
WikiPathway_2023_Human	Alanine And Aspartate Metabolism	Amino Acid and Neurotransmitter Metabolism	0.5	0.0	0.4444444444444445	0.5750976824967072
WikiPathway_2023_Human	Translation Factors	Translation Regulation and Initiation	0.5	0.0	0.3333333333333333	0.5812815476801976
WikiPathway_2023_Human	Electron Transport Chain OXPHOS System In Mitochondria	Mitochondrial electron transport and ATP synthesis	0.2857142857142857	0.16666666666666666	0.30769230769230765	0.6395064974849869
WikiPathway_2023_Human	GPCRs Other	G-protein coupled receptor (GPCR) signaling diversity	0.5	0.0	0.22222222222222224	0.6731798413778274
WikiPathway_2023_Human	Osteoclast Signaling	Regulation of bone resorption and remodeling	0.0	0.0	0.0	0.5707876088128856
WikiPathway_2023_Human	IL 5 Signaling Pathway	Cytokine signaling in immune response and cell proliferation	0.25	0.0	0.16666666666666666	0.5458110974500745
WikiPathway_2023_Human	Matrix Metalloproteinases	Matrix Remodeling and Extracellular Matrix Degradation  	0.5	0.0	0.25	0.5952984952857424
WikiPathway_2023_Human	Pentose Phosphate Metabolism	Pentose Phosphate Pathway	0.6666666666666666	0.5	0.6666666666666666	0.8517154201190578
WikiPathway_2023_Human	Phase I Biotransformations Non P450	Lipid Metabolism and Detoxification	0.0	0.0	0.0	0.4406286322743321
WikiPathway_2023_Human	Androgen Receptor Signaling Pathway	Cell Cycle Regulation and Signal Transduction Modulation	0.25	0.0	0.18181818181818182	0.41008281796261337
WikiPathway_2023_Human	AMP Activated Protein Kinase Signaling	Metabolic Regulation and Energy Homeostasis	0.0	0.0	0.0	0.4072588042411516
WikiPathway_2023_Human	Sphingolipid Pathway	Sphingolipid Metabolism and Signaling	0.5	0.0	0.3333333333333333	0.7469871439075388
WikiPathway_2023_Human	Ganglio Sphingolipid Metabolism	Glycosylation and glycan biosynthesis processes	0.0	0.0	0.0	0.4895748684092786
WikiPathway_2023_Human	Bone Morphogenic Protein Signaling And Regulation	BMP Signaling in Bone Morphogenesis	0.3333333333333333	0.0	0.1818181818181818	0.6845115822814838
WikiPathway_2023_Human	Fatty Acid Beta Oxidation	Fatty Acid Oxidation and Metabolic Regulation	0.75	0.3333333333333333	0.6	0.6872319980802063
WikiPathway_2023_Human	Nucleotide Binding Oligomerization Domain NOD Pathway	Inflammatory Response and Apoptosis Regulation	0.0	0.0	0.0	0.39840946484244033
WikiPathway_2023_Human	Osteopontin Signaling	Inflammatory Response and Signal Transduction	0.5	0.0	0.28571428571428575	0.4333711581794445
WikiPathway_2023_Human	Serotonin Transporter Activity	Serotonergic System Regulation and Inflammatory Response	0.0	0.0	0.0	0.5130506611484547
WikiPathway_2023_Human	Target Of Rapamycin Signaling	mTOR Signaling Pathway and Its Regulation	0.25	0.0	0.2	0.639639160929815
WikiPathway_2023_Human	Selenium Micronutrient Network	Redox Homeostasis and Inflammatory Response	0.0	0.0	0.0	0.3402273954554814
WikiPathway_2023_Human	Physiological And Pathological Hypertrophy Of The Heart	Cardiac hypertrophy and stress response signaling	0.2857142857142857	0.0	0.15384615384615383	0.6086784257392326
WikiPathway_2023_Human	miRNA Regulation Of DNA Damage Response	DNA Damage Response and Cell Cycle Regulation	0.6666666666666666	0.4	0.4615384615384615	0.6651268528996861
WikiPathway_2023_Human	Vitamin D Metabolism	Vitamin D metabolism and homeostasis	1.0	1.0	0.7499999999999999	0.8789995686989063
WikiPathway_2023_Human	Vitamin B12 Metabolism	Inflammation and Lipoprotein Metabolism in Cardiovascular and Metabolic Diseases	0.3333333333333333	0.0	0.16666666666666666	0.2586770653845206
WikiPathway_2023_Human	Angiogenesis	Angiogenesis and Vascular Development	1.0	0.0	0.4	0.7507027247337539
WikiPathway_2023_Human	Energy Metabolism	Regulation of Mitochondrial Biogenesis and Function	0.0	0.0	0.0	0.42317171097862627
WikiPathway_2023_Human	MicroRNAs In Cardiomyocyte Hypertrophy	Signal Transduction and Cellular Response Modulation	0.0	0.0	0.0	0.29392502989590047
WikiPathway_2023_Human	miRNAs Involved In DNA Damage Response	Cell Cycle Regulation and DNA Damage Response	0.5	0.4	0.4615384615384615	0.6147934316034644
WikiPathway_2023_Human	Transcription Factors Regulate miRNAs Related To Cardiac Hypertrophy	Inflammatory Response and Cell Survival Pathways	0.0	0.0	0.0	0.338311391149979
WikiPathway_2023_Human	Type II Diabetes Mellitus	Insulin signaling and glucose metabolism regulation	0.0	0.0	0.0	0.3659297262075319
WikiPathway_2023_Human	Folate Alcohol And Cancer Pathway Hypotheses	One-carbon metabolism and detoxification processes	0.16666666666666666	0.0	0.16666666666666666	0.47326525048401524
WikiPathway_2023_Human	Heart Development	Cardiac Development and Morphogenesis	0.5	0.0	0.3333333333333333	0.6260573687144783
WikiPathway_2023_Human	Nicotine Metabolism In Liver Cells	Xenobiotic Metabolism and Detoxification	0.2	0.0	0.22222222222222224	0.47872115357937567
WikiPathway_2023_Human	Fluoropyrimidine Activity	Nucleotide Metabolism and DNA Repair	0.0	0.0	0.0	0.42368859632448097
WikiPathway_2023_Human	Nicotine Effect On Dopaminergic Neurons	Neurotransmitter Signaling and Synaptic Plasticity	0.0	0.0	0.0	0.38331732289987047
WikiPathway_2023_Human	Codeine And Morphine Metabolism	Hepatic drug metabolism and detoxification	0.5	0.0	0.22222222222222224	0.43731555068825123
WikiPathway_2023_Human	Eicosanoid Synthesis	Eicosanoid biosynthesis and metabolism	0.5	0.0	0.3333333333333333	0.8333512278336852
WikiPathway_2023_Human	Nuclear Receptors	Nuclear Receptor-Mediated Gene Regulation	1.0	1.0	0.5714285714285715	0.730589902583275
WikiPathway_2023_Human	TP53 Network	Apoptosis and Cell Cycle Regulation	0.0	0.0	0.0	0.3843041249044405
WikiPathway_2023_Human	Folate Metabolism	Oxidative Stress Response and Folate Metabolism**	1.0	1.0	0.5	0.64049651774887
WikiPathway_2023_Human	Apoptosis Modulation And Signaling	Apoptosis Regulation and Immune Signaling	0.75	0.0	0.6666666666666665	0.8123111985530956
WikiPathway_2023_Human	Cell Cycle	Cell Cycle Regulation and DNA Damage Response	1.0	1.0	0.4444444444444445	0.5815855572467667
WikiPathway_2023_Human	Proteasome Degradation	Proteasome-mediated antigen processing for MHC class I presentation  	0.5	0.0	0.1818181818181818	0.6383693658347763
WikiPathway_2023_Human	Integrin Mediated Cell Adhesion	Cellular Adhesion and Signal Transduction	0.25	0.0	0.22222222222222224	0.6523385549840821
WikiPathway_2023_Human	Homologous Recombination	DNA Damage Response and Repair	0.0	0.0	0.0	0.4288569968952785
WikiPathway_2023_Human	Peroxisomal Beta Oxidation Of Tetracosanoyl CoA	Peroxisomal Fatty Acid Beta-Oxidation	0.5	0.2	0.5454545454545454	0.7784733861147587
WikiPathway_2023_Human	Cori Cycle	Glycolysis and Glucose Metabolism	0.0	0.0	0.0	0.4436232828175706
WikiPathway_2023_Human	IL 1 Signaling Pathway	Inflammatory Response and Signal Transduction Pathways	0.5	0.0	0.4	0.621215457127464
WikiPathway_2023_Human	Cholesterol Biosynthesis Pathway	Cholesterol Biosynthesis	0.6666666666666666	0.5	0.8	0.8992867959066275
WikiPathway_2023_Human	Integrated Cancer Pathway	Cell Cycle Regulation and DNA Damage Response	0.0	0.0	0.0	0.3336635296721723
WikiPathway_2023_Human	Thyroxine Thyroid Hormone Production	Thyroid Hormone Metabolism and Signaling	0.5	0.3333333333333333	0.4444444444444445	0.6107642905100685
WikiPathway_2023_Human	Sterol Regulatory Element Binding Proteins SREBP Signaling	Lipid Metabolism and Insulin Regulation	0.0	0.0	0.0	0.489358140197133
WikiPathway_2023_Human	SRF And miRs In Smooth Muscle Differentiation And Proliferation	Cardiomyocyte differentiation and cardiac development	0.2222222222222222	0.125	0.2857142857142857	0.4848819420454055
WikiPathway_2023_Human	Genes Targeted By miRNAs In Adipocytes	Cardiac electrophysiology and function regulation	0.0	0.0	0.0	0.1786299195358436
WikiPathway_2023_Human	Effects Of Nitric Oxide	Nitric Oxide Synthesis and Oxygen Transport	0.5	0.3333333333333333	0.4	0.6278444315618703
WikiPathway_2023_Human	Iron Metabolism In Placenta	Iron Metabolism and Homeostasis	0.5	0.3333333333333333	0.5	0.678169535174163
WikiPathway_2023_Human	SREBF And miR33 In Cholesterol And Lipid Homeostasis	Lipid Metabolism and Regulation	0.25	0.0	0.16666666666666666	0.5767976428394174
WikiPathway_2023_Human	RANKL RANK Signaling Pathway	Osteoclast differentiation and function	0.0	0.0	0.0	0.4596127347544533
WikiPathway_2023_Human	Cell Differentiation Expanded Index	Muscle Differentiation and Regeneration Regulation	0.25	0.0	0.22222222222222224	0.4686059938122862
WikiPathway_2023_Human	Cell Differentiation Index	Regulation of cellular differentiation in developmental processes	0.3333333333333333	0.0	0.2	0.4585275548493819
WikiPathway_2023_Human	Thyroid Stimulating Hormone TSH Signaling Pathway	Signal Transduction and Cell Cycle Regulation	0.16666666666666666	0.0	0.16666666666666666	0.4607840305656502
